{
  "schema": "2.0",
  "id": "pk/2cmt-oral",
  "type": "analytical",
  "analytical": "two_compartments_with_absorption",
  "parameters": ["ke", "ka", "kcp", "kpc", "V"],
  "compartments": ["depot", "central", "peripheral"],
  "outputs": [{ "id": "cp", "equation": "central / V" }],
  "editor": {
    "display": {
      "name": "Two-Compartment First-Order Absorption",
      "category": "pk",
      "tags": ["2-compartment", "oral", "linear", "first-order-absorption"]
    },
    "documentation": {
      "summary": "Two-compartment model with first-order oral absorption and first-order elimination"
    }
  }
}
