{
  "schema": "2.0",
  "id": "pk/1cmt-iv-ode",
  "type": "ode",
  "parameters": ["CL", "V"],
  "compartments": ["central"],
  "diffeq": {
    "central": "-CL/V * central + rateiv[0]"
  },
  "outputs": [{ "id": "cp", "equation": "central / V" }],
  "editor": {
    "display": {
      "name": "One-Compartment IV Bolus (ODE)",
      "category": "pk",
      "tags": ["1-compartment", "iv", "ode", "clearance"]
    },
    "documentation": {
      "summary": "One-compartment ODE model using clearance (CL) and volume (V) parameterization"
    }
  }
}
